{"$schema":"https://json-schema.org/draft/2020-12/schema","$id":"https://fde-agent-platform.dev/contracts/change-spec/v1","title":"ChangeSpec","type":"object","additionalProperties":false,"required":["schema","change_spec_id","tenant_ref","workflow_spec_digest","state","source_request","requested_delta","affected_node_ids","unresolved_questions","unresolved_contradiction_ids","blast_radius","reversibility","policy_impact_subjects","required_tests","required_approvals","shadow_plan","canary_plan","rollback_plan","exact_source_digests","candidate_digest","execution_authority","production_admission"],"properties":{"schema":{"const":"fde-agent/change-spec/v1"},"change_spec_id":{"type":"string","pattern":"^[a-z][a-z0-9-]{2,95}$"},"tenant_ref":{"type":"string","minLength":1},"workflow_spec_digest":{"type":"string","pattern":"^[a-f0-9]{64}$"},"state":{"enum":["CANDIDATE","VALIDATED","REFUSED"]},"source_request":{"type":"object","additionalProperties":false,"required":["requester_identity_ref","requester_verified","requester_roles","request_text_digest","natural_language_present"],"properties":{"requester_identity_ref":{"type":"string","minLength":1},"requester_verified":{"type":"boolean"},"requester_roles":{"type":"array","uniqueItems":true,"items":{"type":"string","minLength":1}},"request_text_digest":{"type":"string","pattern":"^[a-f0-9]{64}$"},"natural_language_present":{"type":"boolean"}}},"requested_delta":{"type":"array","minItems":1,"items":{"type":"object","additionalProperties":false,"required":["operation","target_path","candidate_value_digest"],"properties":{"operation":{"enum":["ADD","REMOVE","REPLACE"]},"target_path":{"type":"string","pattern":"^/(states|transitions|controlled_cycles|rollback|reconciliation|release_gates)(/.*)?$"},"candidate_value_digest":{"type":"string","pattern":"^[a-f0-9]{64}$"}}}},"affected_node_ids":{"type":"array","uniqueItems":true,"items":{"type":"string","minLength":1}},"unresolved_questions":{"type":"array","uniqueItems":true,"items":{"type":"string","minLength":1}},"unresolved_contradiction_ids":{"type":"array","uniqueItems":true,"items":{"type":"string","minLength":1}},"blast_radius":{"type":"object","additionalProperties":false,"required":["workflow_count","state_count","transition_count","action_classes","tenant_scope"],"properties":{"workflow_count":{"type":"integer","minimum":1},"state_count":{"type":"integer","minimum":0},"transition_count":{"type":"integer","minimum":0},"action_classes":{"type":"array","uniqueItems":true,"items":{"enum":["NONE","READ","RECOMMEND","DRAFT","REVERSIBLE_ACTION","APPROVED_COMMIT","PROHIBITED"]}},"tenant_scope":{"const":"SINGLE_TENANT"}}},"reversibility":{"enum":["FULL","PARTIAL","NONE"]},"policy_impact_subjects":{"type":"array","uniqueItems":true,"items":{"type":"string","minLength":1}},"required_tests":{"type":"array","minItems":1,"uniqueItems":true,"items":{"type":"string","minLength":1}},"required_approvals":{"type":"array","uniqueItems":true,"items":{"type":"string","minLength":1}},"shadow_plan":{"type":"object","additionalProperties":false,"required":["required","fixture_subjects","divergence_threshold"],"properties":{"required":{"const":true},"fixture_subjects":{"type":"array","minItems":1,"uniqueItems":true,"items":{"type":"string","minLength":1}},"divergence_threshold":{"type":"number","minimum":0,"maximum":1}}},"canary_plan":{"type":"object","additionalProperties":false,"required":["maximum_action_class","maximum_traffic_percent","human_takeover_required"],"properties":{"maximum_action_class":{"enum":["NONE","READ","RECOMMEND","DRAFT","REVERSIBLE_ACTION"]},"maximum_traffic_percent":{"type":"number","minimum":0,"maximum":100},"human_takeover_required":{"const":true}}},"rollback_plan":{"type":"object","additionalProperties":false,"required":["required","strategy","trigger_conditions"],"properties":{"required":{"const":true},"strategy":{"enum":["COMPENSATE","RESTORE_SNAPSHOT","HUMAN_ONLY"]},"trigger_conditions":{"type":"array","minItems":1,"uniqueItems":true,"items":{"type":"string","minLength":1}}}},"exact_source_digests":{"type":"array","minItems":1,"uniqueItems":true,"items":{"type":"string","pattern":"^[a-f0-9]{64}$"}},"candidate_digest":{"type":"string","pattern":"^[a-f0-9]{64}$"},"execution_authority":{"const":"NONE"},"production_admission":{"const":"HUMAN_ADMIT_REQUIRED"}}}
